Review_ID,Title,Review_Text,Rating,Reviewer_Name,Review_Date,Source,Scraped_Date,Sentiment,Sentiment_Confidence,Sentiment_Tags
R0001,Excellent phone with amazing display,"This phone is fantastic. The design is beautiful, build quality is excellent, and the camera performance is outstanding. Battery life is great for the whole day.",5,John Smith,2024-01-15,BestBuy Canada,2024-02-10,Positive,0.9998481273651123,Design (Pos)|Quality (Pos)|Performance (Pos)|Battery/Power (Pos)
R0002,Good purchase but heating issue,"Overall a good phone with nice performance. However, it tends to heat up during intense gaming. The build quality is solid but the overheating is a concern.",3,Sarah Johnson,2024-01-20,BestBuy Canada,2024-02-10,Positive,0.7060975432395935,Quality (Neutral)|Performance (Pos)
R0003,Not worth the price,"Terrible phone for the price. Display is average, battery dies quickly, and the design is bulky. Many better options available. I regret this purchase.",1,Mike Chen,2024-02-01,BestBuy Canada,2024-02-10,Negative,0.999529242515564,Design (Neutral)|Battery/Power (Neutral)|Value (Neg)
R0004,Works perfect for my needs,"I am very satisfied with this purchase. The camera quality is impressive, performance is smooth and fast. User interface is intuitive. Highly recommended!",5,Emma Davis,2024-02-05,BestBuy Canada,2024-02-10,Positive,0.9998626708984375,Quality (Pos)|Performance (Pos)|Ease of Use (Pos)
R0005,Problems with customer service,"The phone itself is okay, but customer service was terrible when I had issues. The warranty claim process was confusing and return policy was not clear. Very disappointed.",2,Robert Wilson,2024-01-28,BestBuy Canada,2024-02-10,Negative,0.9997041821479797,Customer Service (Neg)
